{
  "id": "bca1794759",
  "url": "https://prabhatkhabar.com/state/jharkhand/jamshedpur/jharkhand-108-ambulance-staff-strike-postponed-to-october-26",
  "title": "108 एंबुलेंस हड़ताल: 26 अक्टूबर से, जानें कारण",
  "outlet": "Prabhat Khabar",
  "published": null,
  "collected": "2026-10-25",
  "suggested_movement": null,
  "score": 0.0,
  "matched": [],
  "alternatives": [],
  "ai": {
    "model": "ollama:qwen3:4b",
    "read_chars": 1977,
    "fetch_note": null,
    "drafted": "2026-10-31",
    "is_protest_in_india": true,
    "movement": "jharkhand-108-ambulance-2026",
    "new_movement": null,
    "summary": "In Jharkhand, ambulance staff announced an indefinite strike starting October 26, 2026, after the state government agreed to delay the strike date to accommodate festivals and public emergencies, but their demands for unpaid wages and better conditions remain unresolved.",
    "facts": [
      {
        "claim": "In Jharkhand, ambulance staff announced an indefinite strike starting October 26, 2026",
        "quote": "झारखंड में 108 एंबुलेंस कर्मचारियों की प्रस्तावित राज्यव्यापी अनिश्चितकालीन हड़ताल अब 21 अक्टूबर के बजाय 26 अक्टूबर 2026 से शुरू होगी."
      },
      {
        "claim": "after the state government agreed to delay the strike date to accommodate festivals and public emergencies",
        "quote": "झारखंड प्रदेश एंबुलेंस कर्मचारी संघ ने दुर्गा पूजा, विजयादशमी और आम लोगों की आपातकालीन जरूरतों को ध्यान में रखते हुए हड़ताल की तारीख आगे बढ़ाने का निर्णय लिया है."
      },
      {
        "claim": "but their demands for unpaid wages and better conditions remain unresolved",
        "quote": "संघ के इस फैसले से फिलहाल 108 एंबुलेंस सेवा को त्योहार के दौरान जारी रखने का रास्ता साफ हुआ है. हालांकि, कर्मचारियों की मांगों पर समाधान नहीं होने की स्थिति में 26 अक्टूबर से राज्यव्यापी अनिश्चितकालीन हड़ताल शुरू करने का निर्णय लिया गया है."
      }
    ],
    "signals": {
      "detentions": false,
      "deaths": false,
      "injuries": false,
      "internet_shutdown": false,
      "court_order": false,
      "new_city": false
    },
    "background_note": "Ambulance staff in Jharkhand have been demanding payment for unpaid wages and better working conditions since July, leading to an indefinite strike that was initially scheduled for October 21 but postponed to October 26 to accommodate festivals and public emergencies.",
    "confidence": 0.95,
    "checks": {
      "passed": true,
      "quotes_found": "3/3",
      "names_checked": false,
      "problems": []
    },
    "importance": 0,
    "importance_reason": "No special signals."
  }
}
