{
  "id": "c0d9e762f2",
  "url": "https://newstodaynet.com/2026/10/12/medical-workers-arrested-during-protest-in-chennai/",
  "title": "Medical workers arrested during protest in Chennai",
  "outlet": "News Today",
  "published": "2026-10-12",
  "collected": "2026-10-25",
  "suggested_movement": null,
  "score": 1.0,
  "matched": [
    "Chennai"
  ],
  "alternatives": []
}
